{
  "skill_name": "question",
  "evals": [
    {
      "id": 1,
      "prompt": "Frame research for a public library deciding whether to extend weekend hours. We need a fast set of no more than seven questions before choosing whether to run a pilot.",
      "expected_output": "A concise Research Brief spanning value, affected groups, operational feasibility, alternatives, and evidence needed, without treating the proposal as a defect.",
      "assertions": [
        "The frame identifies the decision and labels consequential assumptions.",
        "It selects only materially relevant concerns rather than reproducing a universal checklist.",
        "It returns at most seven distinct, answerable questions with stable Q IDs in priority order and evidence needed.",
        "The questions consider both potential value and material downside without presuming failure."
      ],
      "stage": "execution"
    },
    {
      "id": 2,
      "prompt": "Create a blind research frame for this incident. Users saw intermittent export delays. Our investigation concluded that database connection-pool exhaustion was the root cause, and the preferred fix is to increase the pool size. The independent researcher must not learn our cause or proposed fix.",
      "expected_output": "A Research Brief whose questions were generated only from a hypothesis-neutral brief, isolated from the originating analysis. It never exposes or privileges the connection-pool theory or pool-size fix.",
      "assertions": [
        "The response returns prioritized research questions rather than stopping at a brief or handing the work back to the caller.",
        "No released question mentions connection-pool exhaustion or increasing pool size.",
        "The response does not call same-context generation procedurally blind, and reports an independence status matching how the questions were actually produced.",
        "The observable export-delay subject and intended independent investigation remain usable.",
        "Removed originating material is never listed or summarized in the released output."
      ],
      "stage": "execution"
    },
    {
      "id": 3,
      "prompt": "What research questions should test the claim that a four-day school week improves teacher retention without harming student outcomes? Prioritize the five questions most likely to change a policy decision.",
      "expected_output": "A Research Brief with five neutral, evidence-seeking questions that test the stated benefits, possible tradeoffs, affected populations, alternative explanations, and decision threshold without assuming the policy succeeds or fails.",
      "assertions": [
        "Exactly five research questions are returned.",
        "The questions have stable Q1 through Q5 identifiers.",
        "The questions test both retention and student outcomes without embedding a conclusion.",
        "Plausible confounding factors or alternatives are investigated symmetrically.",
        "Each question names evidence capable of changing the policy decision."
      ],
      "stage": "execution"
    },
    {
      "id": 4,
      "prompt": "Research current evidence on whether four-day school weeks improve teacher retention, answer the question, and recommend a statewide policy.",
      "expected_output": "A boundary response explaining that the question skill frames investigations but does not conduct research or recommend the policy, while offering to produce a research-question frame if wanted.",
      "assertions": [
        "The response does not claim to conduct the requested research under this skill.",
        "It does not fabricate evidence or recommend a policy.",
        "It distinguishes research framing from research execution and decision authority.",
        "It offers the in-scope framing outcome concisely."
      ],
      "stage": "execution"
    },
    {
      "id": 5,
      "prompt": "Frame research questions for this backlog item. It says our nightly export job has grown slower over six months, that the cause is an unindexed join added in the March schema change, and that the fix is to add a covering index before we commit engineering time.",
      "expected_output": "A Research Brief delivered in one pass, whose questions do not inherit the stated cause or fix, without asking the caller to choose a framing approach first.",
      "assertions": [
        "The response does not ask the caller which framing mode, independence level, or isolation approach to use.",
        "It returns the Research Brief in the same turn rather than proposing a plan or requesting a follow-up invocation.",
        "No released question presupposes the unindexed join or the covering index as the explanation or remedy.",
        "Alternative explanations for the slowdown are investigated symmetrically."
      ],
      "stage": "execution"
    },
    {
      "id": 6,
      "stage": "routing",
      "prompt": "Frame five prioritized research questions for deciding whether to pilot extended public-library weekend hours.",
      "expected_selection": "question",
      "catalog_neighbors": [
        "research",
        "improve-whatever"
      ],
      "assertions": [
        "The selected skill is question.",
        "No neighboring skill is selected for a job it does not own.",
        "Routing uses only catalog names and descriptions.",
        "No task side effect occurs before selection."
      ]
    }
  ],
  "suite_version": "0.1.2",
  "evaluation_contract": "evals/evaluation-contract.json"
}
