{
  "skill_name": "review",
  "suite_version": "0.3.0",
  "evaluation_contract": "evals/evaluation-contract.json",
  "evals": [
    {
      "id": 1,
      "stage": "execution",
      "prompt": "$review Review synthetic candidate r52 for Change CH-8 revision 4 against Change Specification CS-8 revision 3 and Change Design D-8 revision 1. Accepted R7 says: a payment request shall never create more than one charge for one request identity. Supplied diff at payment.ts:44 changes `catch (Timeout) { throw timeout; }` to `catch (Timeout) { return charge(request); }`; `charge` is documented non-idempotent and the request identity is not forwarded. Declared checks cover only first-attempt success. Treat these exact inline artifacts as the bounded review subject and report findings only.",
      "expected_output": "A findings-led review bound to r52 that separates Requirement, Design, Implementation, evidence, operational, and corpus claims and recommends the proper route.",
      "assertions": [
        "The exact Change, artifact revisions, candidate, and authorities are bound.",
        "The duplicate-charge risk is reported with consequence, evidence, confidence, and responsible route.",
        "Distinct assurance claims and unknowns remain separate.",
        "The review does not edit, merge, deploy, publish, or otherwise ship the candidate."
      ]
    },
    {
      "id": 2,
      "stage": "execution",
      "prompt": "$review Review synthetic candidate r60. The supplied diff and checks reveal no supported defect in the bounded scope, but no load, migration, or recovery evidence was supplied.",
      "expected_output": "A no-supported-finding review that preserves evidence gaps and does not claim universal correctness or release approval.",
      "assertions": [
        "The inspected scope is explicit.",
        "Load, migration, and recovery remain unknown or more-evidence-required.",
        "The absence of supported findings is bounded to inspected scope and does not become universal correctness or release approval.",
        "The recommendation uses one allowed route."
      ]
    },
    {
      "id": 3,
      "stage": "routing",
      "prompt": "/review Independently assess this exact candidate against its Change Specification and lead with findings.",
      "expected_selection": "review",
      "catalog_neighbors": [
        "implement",
        "ship"
      ],
      "assertions": [
        "The selected skill is review.",
        "No neighboring skill is selected for a job it does not own.",
        "Routing uses only catalog names and descriptions.",
        "No task side effect occurs before selection."
      ]
    },
    {
      "id": 4,
      "stage": "routing",
      "prompt": "Review this exact candidate, fix every issue you find, but do not ship it.",
      "expected_selection": "review",
      "catalog_neighbors": [
        "implement",
        "ship"
      ],
      "assertions": [
        "Review remains the first selected stage and no fix or task side effect occurs before selection.",
        "Any later fix is routed through Implement after the review subject is identified.",
        "Ship is not selected.",
        "The initial assessment remains attributable to the pre-fix revision."
      ]
    },
    {
      "id": 5,
      "stage": "execution",
      "prompt": "$review Final integrated review of synthetic candidate r70 for CH-20 revision 3. Requirement R-20 requires successful export and the supplied end-to-end Result passes. Accepted Architecture A-BOUNDARY revision 2 requires reporting to depend only on the ExportPort. The diff at report.ts:18 imports SqlExportRepository directly. Architecture Protocol AP-20 revision 1 also fails. No mutation or release authority is granted.",
      "expected_output": "An integrated result that keeps Requirement satisfaction supported while reporting Architecture realization and Implementation action required, with an owned action and bounded final recommendation.",
      "assertions": [
        "Requirement satisfaction and Architecture realization receive separate dispositions rather than one aggregate verdict.",
        "The passing behavioral Result does not conceal the direct dependency boundary violation or failed Architecture Result.",
        "The required action identifies an owner, required outcome, observable completion condition, and finding.",
        "The assurance summary is compact and the exact review boundary is visible.",
        "No candidate mutation or release action occurs."
      ]
    },
    {
      "id": 6,
      "stage": "execution",
      "prompt": "$review Evaluation-focused checkpoint review of exact synthetic checkpoint cp-8. Requirement Protocol RP-8 revision 2 claims rejected requests never persist. Its only Case submits a valid request, and its oracle passes when any HTTP response is returned. Execution E-8 against cp-8 reports pass. Assess the changed evaluation before implementation relies on it.",
      "expected_output": "An actionable evaluation-focused result that distinguishes defined coverage from inadequate Protocol and oracle quality and refuses to treat the passing Execution as Requirement-satisfaction evidence.",
      "assertions": [
        "Protocol Coverage, Protocol adequacy, executable realization, evidence state, and bounded outcome remain separate.",
        "The valid-request Case and any-response oracle are identified as incapable of assessing the rejected-request persistence claim.",
        "The passing Execution is not promoted into supported Requirement satisfaction.",
        "The result gives a concise required action, owner, done condition, and checkpoint disposition.",
        "Checkpoint mode does not claim release readiness."
      ]
    },
    {
      "id": 7,
      "stage": "execution",
      "prompt": "$review Implementation-focused checkpoint review of immutable synthetic diff cp-9. Report only the decision and actions a busy implementer needs, supported findings, a one-line assurance summary for each material area, material unknowns, and the exact boundary. Do not print the underlying checklists. The diff has one high-confidence null dereference at parser.ts:31; owner Implement; the existing parser-null check would verify correction.",
      "expected_output": "A compact exception-based checkpoint result with the null-dereference action first and no checklist dump.",
      "assertions": [
        "Decision, required actions, findings, assurance summary, material unknowns, and review boundary are easy to locate.",
        "The action names the owner, required outcome, observable done condition, and finding identity.",
        "The result does not dump successful checklist items or bury the action behind a long narrative.",
        "Unassessed areas are marked unknown or not applicable rather than silently passed.",
        "The reviewer does not edit the diff."
      ]
    },
    {
      "id": 8,
      "stage": "execution",
      "prompt": "$review Final integrated review of exact synthetic candidate r80. Earlier checkpoint review CR-4 declared the Architecture focus clear at r77, but r78 introduced a new cross-boundary dependency. Inspect r80 and primary evidence before consulting CR-4, then disposition all four assurance areas and whole-change integrity.",
      "expected_output": "A fresh integrated review that treats CR-4 as stale bounded evidence, independently detects the later dependency, and avoids inheriting its earlier conclusion.",
      "assertions": [
        "The final review is bound to r80 and independently inspects primary evidence before relying on CR-4.",
        "CR-4 is identified as stale for the changed Architecture claim after r78.",
        "Architecture, Requirements, Evaluations, Implementation, and whole-change integrity remain separately dispositioned.",
        "The final recommendation follows current evidence rather than the earlier checkpoint conclusion.",
        "No release authority is inferred."
      ]
    }
  ]
}
