{
  "skill_name": "audit-docs",
  "suite_version": "0.1.2",
  "evaluation_contract": "evals/evaluation-contract.json",
  "evals": [
    {
      "id": 1,
      "stage": "execution",
      "prompt": "Audit the docs/ corpus at the current repository revision. Report coverage, evidence-backed findings, strengths, limitations, and remediation routes. Do not edit files.",
      "expected_output": "A snapshot-bound, read-only documentation audit with declared scope and coverage, strengths, traceable findings, limitations, and routed recommendations.",
      "assertions": [
        "The response binds scope and snapshot before making broad claims.",
        "Coverage and blind spots are explicit.",
        "Findings separate evidence, impact, expected state, and route.",
        "No documentation files are changed."
      ]
    },
    {
      "id": 2,
      "stage": "execution",
      "prompt": "Audit and fix our documentation. First determine what is wrong across docs/, then make whatever changes are needed.",
      "expected_output": "A diagnostic finding set completed before any remediation handoff, without silently widening or changing the corpus during the audit stage.",
      "assertions": [
        "The audit contract and coverage are resolved first.",
        "The diagnostic does not mutate documentation.",
        "Accepted findings are routed to author-docs for remediation.",
        "Material information-architecture decisions remain user-authorized."
      ]
    },
    {
      "id": 3,
      "stage": "execution",
      "prompt": "Review this one known README for clarity and rewrite it. There is no corpus-level health question.",
      "expected_output": "A concise boundary response routing the identified-document review and rewrite to author-docs rather than manufacturing a corpus audit.",
      "assertions": [
        "The request is recognized as one-document authoring work.",
        "No corpus-level disposition is claimed.",
        "The response names author-docs as the appropriate route.",
        "No audit scorecard is fabricated."
      ]
    },
    {
      "id": 4,
      "stage": "routing",
      "prompt": "Audit the documentation set under docs/ for discovery, accuracy, coverage, and maintenance risks. Do not change it.",
      "expected_selection": "audit-docs",
      "catalog_neighbors": [
        "author-docs",
        "audit-agent-skill"
      ],
      "assertions": [
        "The selected skill is audit-docs.",
        "No neighboring skill is selected for a job it does not own.",
        "Routing uses only catalog names and descriptions.",
        "No task side effect occurs before selection."
      ]
    }
  ]
}
