{
  "skill_name": "author-docs",
  "suite_version": "0.3.3",
  "evaluation_contract": "evals/evaluation-contract.json",
  "evals": [
    {
      "id": 1,
      "stage": "execution",
      "prompt": "Create a concise how-to guide for rotating a synthetic test credential. The repository already defines the commands and verification check. Do not invent production policy.",
      "expected_output": "A task-oriented guide grounded in supplied repository authority, with prerequisites, ordered action, verification, and no invented policy.",
      "assertions": [
        "The primary reader job is explicit and preserved.",
        "Commands and checks remain grounded in repository authority.",
        "The guide distinguishes prerequisites, action, and verification.",
        "No production policy or unrelated implementation is invented."
      ]
    },
    {
      "id": 2,
      "stage": "execution",
      "prompt": "Review and improve this one README for structure and clarity. Keep its accepted technical meaning and update any required navigation.",
      "expected_output": "A bounded one-document review and revision that preserves accepted meaning, fixes the reader journey, and checks related navigation.",
      "assertions": [
        "The work stays bounded to the identified document and required links.",
        "Accepted technical meaning is preserved.",
        "The revised structure serves one primary reader job.",
        "The handoff does not claim a corpus audit or independent approval."
      ]
    },
    {
      "id": 3,
      "stage": "execution",
      "prompt": "Assess whether the entire documentation corpus is healthy, complete, current, and discoverable. Do not change anything.",
      "expected_output": "A routing boundary that leaves corpus-level diagnostic assessment to audit-docs.",
      "assertions": [
        "The request is recognized as a corpus audit.",
        "No files are changed.",
        "The response does not substitute a one-document authoring review.",
        "The audit-docs route is named clearly."
      ]
    },
    {
      "id": 4,
      "stage": "routing",
      "prompt": "Rewrite this README so a new contributor can complete setup and verify success.",
      "expected_selection": "author-docs",
      "catalog_neighbors": ["audit-docs", "author-agent-instructions"],
      "assertions": [
        "The selected skill is author-docs.",
        "No neighboring skill is selected for a job it does not own.",
        "Routing uses only catalog names and descriptions.",
        "No task side effect occurs before selection."
      ]
    }
  ]
}
